{
  "worksheet_id": "WS-01",
  "title": "一次方程式",
  "grade": "中1",
  "problems": [
    {
      "problem_no": 1,
      "text": "3x + 5 = 20 を解きなさい。",
      "answer": "x = 5",
      "leak_strings": ["x=5", "3x=15"],
      "typical_mistakes": ["5 を移項するとき符号を変え忘れて 3x = 25"],
      "fixed_hints": {
        "1": "今、何を求めようとしてる？",
        "2": "左の 5 を右に持っていくとき、符号はどうなる？"
      },
      "fixed_check_correct": "正解。移項の符号、ばっちり",
      "fixed_check_incorrect": "もう一回、5 を移した後の符号を見てみて"
    },
    {
      "problem_no": 2,
      "text": "2x - 7 = 4x + 3 を解きなさい。",
      "answer": "x = -5",
      "leak_strings": ["x=-5", "-2x=10", "2x=-10", "マイナス5", "マイナスご"],
      "typical_mistakes": ["移項で符号を変え忘れる", "両辺をマイナスで割るときの符号"],
      "fixed_hints": {
        "1": "今、何を求めようとしてる？",
        "2": "右辺に移したときの符号、もう一回見てみて"
      },
      "fixed_check_correct": "正解。符号の直し方、ばっちり",
      "fixed_check_incorrect": "もう一回、2 行目の符号を見てみて"
    },
    {
      "problem_no": 3,
      "text": "5(x - 2) = 3x + 4 を解きなさい。",
      "answer": "x = 7",
      "leak_strings": ["x=7", "2x=14", "5x-10"],
      "typical_mistakes": ["分配法則で 5x - 2 にする"],
      "fixed_hints": {
        "1": "今、何を求めようとしてる？",
        "2": "かっこを外したとき、5 は中の両方にかかってる？"
      },
      "fixed_check_correct": "正解。かっこの外し方、ばっちり",
      "fixed_check_incorrect": "もう一回、かっこの中の 2 つ目を見てみて"
    },
    {
      "problem_no": 4,
      "text": "x/3 + 2 = 5 を解きなさい。",
      "answer": "x = 9",
      "leak_strings": ["x=9", "x/3=3"],
      "typical_mistakes": ["両辺に 3 をかけるとき 2 にかけ忘れる"],
      "fixed_hints": {
        "1": "今、何を求めようとしてる？",
        "2": "両辺に 3 をかけるなら、2 にもかける？"
      },
      "fixed_check_correct": "正解。3 のかけ方、ばっちり",
      "fixed_check_incorrect": "もう一回、2 にも 3 をかけたか見てみて"
    }
  ]
}
